{
  "decision_id": "D-002-A-20260819",
  "schema_version": "0.1.0-draft",
  "content_hash": "53C3BC96C26C40BF5892D7F0058C02E26204AE45818112E2817286A1D5070712",
  "decision_context": "PROJECT_GOVERNANCE",
  "governance_context_ref": {
    "document": "decisions/source/MVP_CONTRACT_DECISIONS.request.md",
    "document_sha256": "C226AB3B85063AA19EC0000B261342D5907B528C985FDD941C8E8BBAEBA25FBD"
  },
  "decision_request_ref": {
    "request_id": "D-002",
    "content_hash": "06BC92F797E24911E7E957D3D852DA08D87BA502017C17B75A75E4EB3C61FF46"
  },
  "gate_id": "GOV_MVP_REPLAY_GATE_PROFILE",
  "action": "APPROVE",
  "decision_mode": "HUMAN_SELECTED",
  "selected_option_id": "A",
  "actor_id": "project_owner_01",
  "actor_role": "project_owner",
  "reason": "项目所有者明确选择方案 A，未提供与本决定相关的额外理由。",
  "scope": "MVP_BASELINE/D-002",
  "bound_artifact_refs": [],
  "bound_finding_refs": [],
  "bound_stage_attempt_keys": [],
  "created_at": "2026-08-19T20:42:38+08:00"
}
