{
  "decision_id": "D-004-A-20260819",
  "schema_version": "0.1.0-draft",
  "content_hash": "51C7E708BF2B51B1B6E2AF30AA697EE2056D67E91CB1A5E73225628AD3447D4F",
  "decision_context": "PROJECT_GOVERNANCE",
  "governance_context_ref": {
    "document": "decisions/source/D-004.request.md",
    "document_sha256": "F1CF0AE3E490A5776AA3A8067C65DAB5F8FFF00B0F622471E553B94FA8782427"
  },
  "decision_request_ref": {
    "request_id": "D-004",
    "content_hash": "0912F3AF4AA5A4AFA1FBC6AC893AB46C7E112BB8DA1CC4AD36C30100DFC6BA1C"
  },
  "gate_id": "GOV_REPLAY_UNIT_POLICY",
  "action": "APPROVE",
  "decision_mode": "HUMAN_SELECTED",
  "selected_option_id": "A",
  "actor_id": "project_owner_01",
  "actor_role": "project_owner",
  "reason": "项目所有者明确选择方案 A，并注明无补充意见。",
  "scope": "MVP_BASELINE/D-004",
  "bound_artifact_refs": [],
  "bound_finding_refs": [],
  "bound_stage_attempt_keys": [],
  "created_at": "2026-08-19T21:05:37+08:00"
}
